{
  "entityHeader": {
    "entityId": "CAR-2025-001",
    "entityType": "Car",
    "createdAt": "2025-01-15T08:30:00Z",
    "updatedAt": "2025-06-01T14:45:00Z"
  },
  "id": "CAR-2025-001",
  "vin": "5TDJKRFH4LS123456",
  "make": "Tesla",
  "model": "Model S",
  "year": 2025,
  "color": "Midnight Silver",
  "mileage": 45000,
  "lastServiceDate": "2025-06-01T00:00:00Z",
  "totalBalance": 0.0,
  "lastLoanPaymentDate": "2025-06-01T00:00:00Z",
  "owner": "John Doe"
}
